{
  "schema_version": 1,
  "roster": [
    {
      "id": "enemy.drowned_pilgrim", "schema_version": 1, "enabled": true,
      "earliest_release_stage": "core", "localization_name_key": "enemy.drowned_pilgrim.name",
      "localization_description_key": "enemy.drowned_pilgrim.description",
      "asset_ids": ["sprite.enemy.drowned_pilgrim", "portrait.enemy.drowned_pilgrim"],
      "tags": ["normal", "fodder"], "source_document_feature_id": "CONT-ENEMY-001",
      "rank": "normal", "source_kind": "immutable_first_playable",
      "required_pattern_ids": ["pattern.enemy.drowned_pilgrim.fan"],
      "reward_profile_id": "reward.normal_outer", "xp_profile_id": "xp.normal_t1",
      "authored_core_enabled": true
    },
    {
      "id": "enemy.mire_leech", "schema_version": 1, "enabled": true,
      "earliest_release_stage": "core", "localization_name_key": "enemy.mire_leech.name",
      "localization_description_key": "enemy.mire_leech.description",
      "asset_ids": ["sprite.enemy.mire_leech", "portrait.enemy.mire_leech"],
      "tags": ["normal", "fodder"], "source_document_feature_id": "CONT-ENEMY-002",
      "rank": "normal", "source_kind": "authored_core",
      "required_pattern_ids": ["pattern.enemy.mire_leech.charge"],
      "reward_profile_id": "reward.normal_outer", "xp_profile_id": "xp.normal_t1",
      "authored_core_enabled": true
    },
    {
      "id": "enemy.bell_reed", "schema_version": 1, "enabled": true,
      "earliest_release_stage": "core", "localization_name_key": "enemy.bell_reed.name",
      "localization_description_key": "enemy.bell_reed.description",
      "asset_ids": ["sprite.enemy.bell_reed", "portrait.enemy.bell_reed"],
      "tags": ["normal", "pressure"], "source_document_feature_id": "CONT-ENEMY-001",
      "rank": "normal", "source_kind": "immutable_first_playable",
      "required_pattern_ids": ["pattern.enemy.bell_reed.gap_ring"],
      "reward_profile_id": "reward.normal_outer", "xp_profile_id": "xp.normal_t1",
      "authored_core_enabled": true
    },
    {
      "id": "enemy.bell_acolyte", "schema_version": 1, "enabled": true,
      "earliest_release_stage": "core", "localization_name_key": "enemy.bell_acolyte.name",
      "localization_description_key": "enemy.bell_acolyte.description",
      "asset_ids": ["sprite.enemy.bell_acolyte", "portrait.enemy.bell_acolyte"],
      "tags": ["normal", "pressure"], "source_document_feature_id": "CONT-ENEMY-002",
      "rank": "normal", "source_kind": "authored_core",
      "required_pattern_ids": ["pattern.enemy.bell_acolyte.alternating_fan"],
      "reward_profile_id": "reward.normal_outer", "xp_profile_id": "xp.normal_t1",
      "authored_core_enabled": true
    },
    {
      "id": "enemy.chain_sentry", "schema_version": 1, "enabled": true,
      "earliest_release_stage": "core", "localization_name_key": "enemy.chain_sentry.name",
      "localization_description_key": "enemy.chain_sentry.description",
      "asset_ids": ["sprite.enemy.chain_sentry", "portrait.enemy.chain_sentry"],
      "tags": ["normal", "anchor"], "source_document_feature_id": "CONT-ENEMY-001",
      "rank": "normal", "source_kind": "immutable_first_playable",
      "required_pattern_ids": ["pattern.enemy.chain_sentry.cross_lanes"],
      "reward_profile_id": "reward.normal_outer", "xp_profile_id": "xp.normal_t1",
      "authored_core_enabled": true
    },
    {
      "id": "enemy.choir_skull", "schema_version": 1, "enabled": true,
      "earliest_release_stage": "core", "localization_name_key": "enemy.choir_skull.name",
      "localization_description_key": "enemy.choir_skull.description",
      "asset_ids": ["sprite.enemy.choir_skull", "portrait.enemy.choir_skull"],
      "tags": ["normal", "disruptor"], "source_document_feature_id": "CONT-ENEMY-002",
      "rank": "normal", "source_kind": "authored_core",
      "required_pattern_ids": ["pattern.enemy.choir_skull.rotor"],
      "reward_profile_id": "reward.normal_outer", "xp_profile_id": "xp.normal_t1",
      "authored_core_enabled": true
    },
    {
      "id": "miniboss.sepulcher_knight", "schema_version": 1, "enabled": true,
      "earliest_release_stage": "core", "localization_name_key": "miniboss.sepulcher_knight.name",
      "localization_description_key": "miniboss.sepulcher_knight.description",
      "asset_ids": ["sprite.miniboss.sepulcher_knight", "portrait.miniboss.sepulcher_knight"],
      "tags": ["miniboss", "elite", "anchor"], "source_document_feature_id": "ENC-014",
      "rank": "miniboss", "source_kind": "authored_core",
      "required_pattern_ids": ["miniboss.sepulcher_knight.charge_lane", "miniboss.sepulcher_knight.stop_ring", "miniboss.sepulcher_knight.shield_fan"],
      "reward_profile_id": "reward.miniboss_t1", "xp_profile_id": "xp.miniboss_t1",
      "authored_core_enabled": true
    },
    {
      "id": "miniboss.choir_abbot", "schema_version": 1, "enabled": true,
      "earliest_release_stage": "core", "localization_name_key": "miniboss.choir_abbot.name",
      "localization_description_key": "miniboss.choir_abbot.description",
      "asset_ids": ["sprite.miniboss.choir_abbot", "portrait.miniboss.choir_abbot"],
      "tags": ["miniboss", "elite", "disruptor"], "source_document_feature_id": "ENC-014",
      "rank": "miniboss", "source_kind": "authored_core",
      "required_pattern_ids": ["miniboss.choir_abbot.rotor", "miniboss.choir_abbot.recovery_ring"],
      "reward_profile_id": "reward.miniboss_t1", "xp_profile_id": "xp.miniboss_t1",
      "authored_core_enabled": true
    }
  ],
  "rooms": [
    {
      "id": "room.bell.vestibule_01", "schema_version": 1, "enabled": true,
      "earliest_release_stage": "core", "localization_name_key": "room.bell.vestibule_01.name",
      "localization_description_key": "room.bell.vestibule_01.description",
      "asset_ids": ["tilemap.room.bell.vestibule_01"], "tags": ["room", "bell", "safe"],
      "source_document_feature_id": "CONT-ROOM-002", "width_milli_tiles": 13000, "height_milli_tiles": 11000,
      "doors": [{"id":"west","side":"west","offset_milli_tiles":5500,"width_milli_tiles":3000},{"id":"east","side":"east","offset_milli_tiles":5500,"width_milli_tiles":3000}],
      "volumes": [],
      "anchors": [{"id":"safe","kind":"safe_entry","point":{"x":3000,"y":5500},"bound_content_id":null},{"id":"exit","kind":"exit","point":{"x":10000,"y":5500},"bound_content_id":null}],
      "safe_noncombat": true, "authored_core_enabled": true
    },
    {
      "id": "room.bell.cross_01", "schema_version": 1, "enabled": true,
      "earliest_release_stage": "core", "localization_name_key": "room.bell.cross_01.name",
      "localization_description_key": "room.bell.cross_01.description",
      "asset_ids": ["tilemap.room.bell.cross_01"], "tags": ["room", "bell", "combat"],
      "source_document_feature_id": "CONT-ROOM-002", "width_milli_tiles": 17000, "height_milli_tiles": 17000,
      "doors": [{"id":"north","side":"north","offset_milli_tiles":8500,"width_milli_tiles":3000},{"id":"east","side":"east","offset_milli_tiles":8500,"width_milli_tiles":3000},{"id":"south","side":"south","offset_milli_tiles":8500,"width_milli_tiles":3000},{"id":"west","side":"west","offset_milli_tiles":8500,"width_milli_tiles":3000}],
      "volumes": [
        {"id":"solid.nw","kind":"solid","geometry":{"shape":"rectangle","rectangle":{"x":4000,"y":4000,"width":2000,"height":2000}}},
        {"id":"solid.ne","kind":"solid","geometry":{"shape":"rectangle","rectangle":{"x":11000,"y":4000,"width":2000,"height":2000}}},
        {"id":"solid.sw","kind":"solid","geometry":{"shape":"rectangle","rectangle":{"x":4000,"y":11000,"width":2000,"height":2000}}},
        {"id":"solid.se","kind":"solid","geometry":{"shape":"rectangle","rectangle":{"x":11000,"y":11000,"width":2000,"height":2000}}},
        {"id":"lane.horizontal","kind":"pattern_lane","geometry":{"shape":"polyline","width_milli_tiles":1000,"points":[{"x":2000,"y":8500},{"x":15000,"y":8500}]}},
        {"id":"lane.vertical","kind":"pattern_lane","geometry":{"shape":"polyline","width_milli_tiles":1000,"points":[{"x":8500,"y":2000},{"x":8500,"y":15000}]}}
      ],
      "anchors": [
        {"id":"f1","kind":"fodder","point":{"x":3000,"y":3000},"bound_content_id":null},{"id":"f2","kind":"fodder","point":{"x":8500,"y":3000},"bound_content_id":null},{"id":"f3","kind":"fodder","point":{"x":14000,"y":3000},"bound_content_id":null},
        {"id":"f4","kind":"fodder","point":{"x":3000,"y":14000},"bound_content_id":null},{"id":"f5","kind":"fodder","point":{"x":8500,"y":14000},"bound_content_id":null},{"id":"f6","kind":"fodder","point":{"x":14000,"y":14000},"bound_content_id":null},
        {"id":"p1","kind":"pressure","point":{"x":3000,"y":8500},"bound_content_id":null},{"id":"p2","kind":"pressure","point":{"x":14000,"y":8500},"bound_content_id":null},{"id":"a1","kind":"anchor_enemy","point":{"x":8500,"y":8500},"bound_content_id":null}
      ], "safe_noncombat": false, "authored_core_enabled": true
    },
    {
      "id": "room.bell.nave_01", "schema_version": 1, "enabled": true,
      "earliest_release_stage": "core", "localization_name_key": "room.bell.nave_01.name",
      "localization_description_key": "room.bell.nave_01.description",
      "asset_ids": ["tilemap.room.bell.nave_01"], "tags": ["room", "bell", "combat"],
      "source_document_feature_id": "CONT-ROOM-002", "width_milli_tiles": 15000, "height_milli_tiles": 21000,
      "doors": [{"id":"north","side":"north","offset_milli_tiles":7500,"width_milli_tiles":3000},{"id":"south","side":"south","offset_milli_tiles":7500,"width_milli_tiles":3000}],
      "volumes": [
        {"id":"pew.nw","kind":"solid","geometry":{"shape":"rectangle","rectangle":{"x":3000,"y":6000,"width":3000,"height":1000}}},{"id":"pew.ne","kind":"solid","geometry":{"shape":"rectangle","rectangle":{"x":9000,"y":6000,"width":3000,"height":1000}}},